Koktejl,Němka přenechala koupelnu holubům, sprchovat se chodí k příteli,1147,90,23539669,81,8657367,75,76285963,69,13687881
Film,Velký vlastenecký výlet: Hrůzy, které zazní od dezolátů na válečné Ukrajině,1110,88,55855856,86,12612613,83,15315315,69,81981982
Řetězák,Internetem se šíří smutné pohledy údajných zadržených britských vojáků. Jde o dílo umělé inteligence,1110,40,54054054,26,84684685,18,73873874,7,207207207
Hry a herní systémy,Gamescom 2025: 10 nejlepších trailerů z největšího herního veletrhu na světě,1110,76,30630631,64,41441441,51,98198198,27,11711712
Věda a školy,Vzácné záběry. Mezihvězdnou kometu 3IATLAS mají vědci dále „v hledáčku“,1107,88,70822042,75,70009033,64,13730804,52,12285456
Koktejl,Seniorka finále Miss Universe Korea nevyhrála, získala cenu za nejhezčí šaty,1094,78,42778793,71,75502742,66,08775137,61,60877514
Hry a herní systémy,Gamescom 2025: Tankové bitvy v jedné rodině. World of Tanks chystá novinky,1070,77,85046729,63,27102804,50,56074766,28,5046729
Krimi,Jeřáb nesundal rameno a narazil jím do mostu na dálnici D3,1068,82,77153558,73,78277154,55,24344569,45,50561798
Film,Oběti vypreparoval orgány, nakonec jí vyčistil zuby. Do kin míří Stvůry podle české detektivky roku,1037,78,97782064,63,45226615,51,97685632,37,60848602
Krimi,Ukradené cenné sochy od Kodeta a Brože sešrotovali ve sběrně,1025,82,82926829,74,14634146,63,6097561,55,80487805
Koktejl,Krysa pobíhala řidiči na kapotě, když jel po čínské dálnici,1003,86,34097707,79,96011964,72,78165503,72,78165503
